{
  "schema_version": "3.0.0",
  "goal_id": "G08",
  "branch": "hermes/08-reconciliation-assistant",
  "base_sha": "<sha>",
  "head_sha": "<sha>",
  "goal_package_sha256": "<64-hex-sha256>",
  "completion_level": "branch_ready",
  "jira_features": [
    "AMFA-220",
    "AMFA-221"
  ],
  "jira_subtasks": [
    "AMFA-262",
    "AMFA-263",
    "AMFA-264",
    "AMFA-265",
    "AMFA-266",
    "AMFA-267",
    "AMFA-268",
    "AMFA-269"
  ],
  "branch_ready": false,
  "harness_ready": false,
  "integration_verified": false,
  "jira_complete": false,
  "automated_tests": "BLOCKED",
  "manual_tests": "BLOCKED",
  "documentation": "BLOCKED",
  "architecture_audit": "BLOCKED",
  "product_audit": "BLOCKED",
  "human_product_signoff": "not_required",
  "blocked_integrated_criteria": [],
  "limitations": [],
  "pushed": false,
  "push_remote": null,
  "push_branch": null
}
